id,gate,phase_scope,criteria,decision_rule
GATE-00,Go programme v4.8.1,P00,Matrice CDC→roadmap complète; backlog priorisé; risques connus; arbitrages actés.,Programme autorisé uniquement si les décisions v4.8.1 sont tracées.
GATE-01,Go Foundation Alpha,P01-P02,CI verte; édition model testé; API baseline; services cibles documentés.,Autorise démarrage installateurs et runtime.
GATE-02,Go Installer Alpha,P03-P06,install.ini validé; dépendances installées; PGDATA /data/openinfra; openinfra.service; failover DB démontré.,Autorise MVP Lite/Pro.
GATE-03,Go Lite MVP,P07-P11,Limits Lite respectées; all-in-one opérationnel; UI/API/CLI ITRM/DCIM/IPAM.,Autorise pilote Lite.
GATE-04,Go Pro MVP,P07-P13,Backend/web séparés; LDAP/IPA; RBAC groupes; connecteurs ITSM externes; quotas Pro.,Autorise pilote Pro.
GATE-05,Go Enterprise Foundation,P14-P17,"Agents, multisite, synchronisation quasi temps réel, cluster frontend/backend, DR testé.",Autorise pilote Entreprise.
GATE-06,Go RC,P16-P18,Modules avancés; sécurité; performance; docs; migrations et rollback validés.,Autorise release candidate.
GATE-07,Go GA,P18,Benchmarks; chaos; PITR; failover; sécurité; packaging; support; runbooks validés.,Autorise GA Enterprise Scale.
